<?xml version="1.0" encoding="UTF-8"?>
<!-- IVAN SANTANA FERNANDEZ-->
<informacioncliente xmlns:xsi="http://www.w3.org/2001/XMLSchema-instance"
xsi:noNamespaceSchemaLocation="clientinfo.xsd"
name="WoeRO" typegame="MMORPG">
  <desc>Información Cliente Ragnarok</desc>
  <servicetype>Alemania</servicetype>
  <servertype>sakray</servertype>
  <connection servidor="1" tipo="PlayerKill" Online="Muchas">
    <data_ini ano="2012" mes="Enero" dia="10"/>
    <display>WoeRO Third Job</display>
    <address>55.34.127.0</address>
    <port>6901</port>
    <version>1</version>
    <langtype>10</langtype>
    <account> 
            <admin id="A1000002">GM General</admin>
            <admin id="A1000003">GM Sprites</admin>
            <admin id="A1000228">GM Scrips</admin>
            <admin id="A1001093">GM Events</admin>
            <admin id="A1000289">GM Support</admin>
            <responsible ref="1000002A">Encargado del sistema y gestión del servidor</responsible>
            <responsible ref="1000003A">Encargado de crear Sprites</responsible>
            <responsible ref="1000228A">Encargado de crear Scrips</responsible>
            <responsible ref="1001093A">Encargado de crear eventos en el juego</responsible>
            <responsible ref="1000289A">Encargado de atender a los usuarios</responsible>
    </account>
    <usuarios>
        <userprueba codigos="354125689">Pablo</userprueba>
        <userprueba codigos="872323489">Diego</userprueba>
        <userprueba codigos="915624589">Uxia</userprueba>
        <userprueba codigos="915624589">Uxia</userprueba>
    </usuarios>
    <registrationaccount>_m  _f</registrationaccount> 
  </connection>
</informacioncliente>
